462|40340|40340|Rochester, MN|Rochester, MN Metro Area|M1|1|G3110|6415950878|74793561|+43.9499166|-092.3356986
450|39580|39580|Raleigh, NC|Raleigh, NC Metro Area|M1|1|G3110|5486334833|75209779|+35.7567464|-078.4604412
452|39660|39660|Rapid City, SD|Rapid City, SD Metro Area|M1|1|G3110|20213817245|56156476|+44.1951082|-102.9166120
464|40380|40380|Rochester, NY|Rochester, NY Metro Area|M1|1|G3110|8459599412|5126898044|+43.1480380|-077.5232575
154|39700|39700|Raymondville, TX|Raymondville, TX Micro Area|M2|2|G3110|1529529770|501714610|+26.4803815|-097.5832559
428|39740|39740|Reading, PA|Reading, PA Metro Area|M1|1|G3110|2218272198|24025110|+40.4139565|-075.9268598
454|39780|39780|Red Bluff, CA|Red Bluff, CA Micro Area|M2|2|G3110|7639716084|32276053|+40.1261561|-122.2322757
454|39820|39820|Redding, CA|Redding, CA Metro Area|M1|1|G3110|9778188422|186530228|+40.7605142|-122.0435556
378|39860|39860|Red Wing, MN|Red Wing, MN Micro Area|M2|2|G3110|1960200565|61025133|+44.4061779|-092.7160003
456|39900|39900|Reno, NV|Reno, NV Metro Area|M1|1|G3110|17004014251|623065119|+40.5007953|-119.7311608
292|39940|39940|Rexburg, ID|Rexburg, ID Micro Area|M2|2|G3110|6041798924|93681212|+44.1427534|-111.5081067
458|39980|39980|Richmond, IN|Richmond, IN Micro Area|M2|2|G3110|1040508995|6732227|+39.8630908|-085.0067351
|40060|40060|Richmond, VA|Richmond, VA Metro Area|M1|1|G3110|11852387536|327753878|+37.4634618|-077.4751772
336|40080|40080|Richmond-Berea, KY|Richmond-Berea, KY Micro Area|M2|2|G3110|1952453536|19442034|+37.5716804|-084.2962641
365|40100|40100|Rio Grande City, TX|Rio Grande City, TX Micro Area|M2|2|G3110|3168060433|15302229|+26.5309027|-098.7402346
348|40140|40140|Riverside-San Bernardino-Ontario, CA|Riverside-San Bernardino-Ontario, CA Metro Area|M1|1|G3110|70612013193|374885513|+34.5375344|-116.1309212
|40180|40180|Riverton, WY|Riverton, WY Micro Area|M2|2|G3110|23786070473|212130290|+43.0548310|-108.6089349
|40220|40220|Roanoke, VA|Roanoke, VA Metro Area|M1|1|G3110|4839940345|72650058|+37.2862262|-079.9469346
468|40260|40260|Roanoke Rapids, NC|Roanoke Rapids, NC Micro Area|M2|2|G3110|3265133020|54672508|+36.3205759|-077.5427565
466|40300|40300|Rochelle, IL|Rochelle, IL Micro Area|M2|2|G3110|1964706943|11425020|+42.0418840|-089.3201764
466|40420|40420|Rockford, IL|Rockford, IL Metro Area|M1|1|G3110|2056738223|18555985|+42.3311830|-089.0429139
|40460|40460|Rockingham, NC|Rockingham, NC Micro Area|M2|2|G3110|1227297998|15684090|+35.0046360|-079.7556946
|40540|40540|Rock Springs, WY|Rock Springs, WY Micro Area|M2|2|G3110|27004874067|166887507|+41.6603282|-108.8756774
468|40580|40580|Rocky Mount, NC|Rocky Mount, NC Metro Area|M1|1|G3110|2708235052|9748810|+35.9410455|-077.7985494
|40620|40620|Rolla, MO|Rolla, MO Micro Area|M2|2|G3110|1739898840|6587846|+37.8663263|-091.7903492
470|40660|40660|Rome, GA|Rome, GA Metro Area|M1|1|G3110|1320694720|22123870|+34.2636769|-085.2137297
|40700|40700|Roseburg, OR|Roseburg, OR Micro Area|M2|2|G3110|13044369135|252033343|+43.2863277|-123.1544760
|40740|40740|Roswell, NM|Roswell, NM Micro Area|M2|2|G3110|15708999758|25504229|+33.3616045|-104.4698374
488|41860|41860|San Francisco-Oakland-Hayward, CA|San Francisco-Oakland-Hayward, CA Metro Area|M1|1|G3110|6416945490|2456709618|+37.7737185|-122.2744317
|40780|40780|Russellville, AR|Russellville, AR Micro Area|M2|2|G3110|4513146602|96078148|+35.1997152|-093.2528620
384|40820|40820|Ruston, LA|Ruston, LA Micro Area|M2|2|G3110|1221806077|1897710|+32.6018231|-092.6623026
|40860|40860|Rutland, VT|Rutland, VT Micro Area|M2|2|G3110|2408234745|38735277|+43.5808577|-073.0382023
472|40900|40900|Sacramento--Roseville--Arden-Arcade, CA|Sacramento--Roseville--Arden-Arcade, CA Metro Area|M1|1|G3110|13194448617|549284977|+38.7896779|-121.0057504
364|41900|41900|San Germ�n, PR|San Germ�n, PR Metro Area|M1|1|G3110|571523710|383938385|+18.0330687|-067.1039609
488|41940|41940|San Jose-Sunnyvale-Santa Clara, CA|San Jose-Sunnyvale-Santa Clara, CA Metro Area|M1|1|G3110|6938469229|40399480|+36.9084718|-121.3713721
|40940|40940|Safford, AZ|Safford, AZ Micro Area|M2|2|G3110|11972307736|47704127|+32.9318277|-109.8783103
474|40980|40980|Saginaw, MI|Saginaw, MI Metro Area|M1|1|G3110|2073181545|40159813|+43.3282667|-084.0554100
378|41060|41060|St. Cloud, MN|St. Cloud, MN Metro Area|M1|1|G3110|4535661520|134110732|+45.5930311|-094.4883636
|41100|41100|St. George, UT|St. George, UT Metro Area|M1|1|G3110|6284076375|9250777|+37.2625308|-113.4878003
312|41140|41140|St. Joseph, MO-KS|St. Joseph, MO-KS Metro Area|M1|1|G3110|4287703404|50999768|+39.8348430|-094.7837537
476|41180|41180|St. Louis, MO-IL|St. Louis, MO-IL Metro Area|M1|1|G3110|20366562375|565401629|+38.7404035|-090.3459564
300|41220|41220|St. Marys, GA|St. Marys, GA Micro Area|M2|2|G3110|1588171666|436849672|+30.9133473|-081.6420006
566|41400|41400|Salem, OH|Salem, OH Micro Area|M2|2|G3110|1377695749|7239793|+40.7700730|-080.7784550
440|41420|41420|Salem, OR|Salem, OR Metro Area|M1|1|G3110|4977786165|34506590|+44.9033845|-122.9017571
|41460|41460|Salina, KS|Salina, KS Micro Area|M2|2|G3110|3732062916|4371284|+38.9645697|-097.6633868
|41500|41500|Salinas, CA|Salinas, CA Metro Area|M1|1|G3110|8496777451|1270701096|+36.2401070|-121.3155732
|41540|41540|Salisbury, MD-DE|Salisbury, MD-DE Metro Area|M1|1|G3110|5435116412|2080609903|+38.3995211|-075.4782615
482|41620|41620|Salt Lake City, UT|Salt Lake City, UT Metro Area|M1|1|G3110|19900245769|1062134642|+40.5225926|-112.9605168
|41660|41660|San Angelo, TX|San Angelo, TX Metro Area|M1|1|G3110|6665406534|48281267|+31.3653095|-100.6594181
|41700|41700|San Antonio-New Braunfels, TX|San Antonio-New Braunfels, TX Metro Area|M1|1|G3110|18939839605|150588190|+29.4330599|-098.6069734
|41740|41740|San Diego-Carlsbad, CA|San Diego-Carlsbad, CA Metro Area|M1|1|G3110|10895213672|826296339|+33.0236041|-116.7761174
|41760|41760|Sandpoint, ID|Sandpoint, ID Micro Area|M2|2|G3110|4492522261|478947473|+48.3246293|-116.6274296
184|41780|41780|Sandusky, OH|Sandusky, OH Micro Area|M2|2|G3110|651627581|969641285|+41.5540061|-082.5258973
450|41820|41820|Sanford, NC|Sanford, NC Micro Area|M2|2|G3110|660333360|10584996|+35.4763365|-079.1721174
490|41980|41980|San Juan-Carolina-Caguas, PR|San Juan-Carolina-Caguas, PR Metro Area|M1|1|G3110|3724111451|1458574183|+18.2946761|-066.0370968
|42020|42020|San Luis Obispo-Paso Robles-Arroyo Grande, CA|San Luis Obispo-Paso Robles-Arroyo Grande, CA Metro Area|M1|1|G3110|8543653416|820437991|+35.3852264|-120.4475416
488|42100|42100|Santa Cruz-Watsonville, CA|Santa Cruz-Watsonville, CA Metro Area|M1|1|G3110|1152864628|419570859|+37.0124883|-122.0072050
106|42140|42140|Santa Fe, NM|Santa Fe, NM Metro Area|M1|1|G3110|4945413451|3645651|+35.5143214|-105.9657722
434|42180|42180|Santa Isabel, PR|Santa Isabel, PR Micro Area|M2|2|G3110|88144282|111140647|+17.9529217|-066.3875885
|42200|42200|Santa Maria-Santa Barbara, CA|Santa Maria-Santa Barbara, CA Metro Area|M1|1|G3110|7083926264|2729818040|+34.5370572|-120.0399729
488|42220|42220|Santa Rosa, CA|Santa Rosa, CA Metro Area|M1|1|G3110|4081401368|497545779|+38.5246685|-122.9376276
|42300|42300|Sault Ste. Marie, MI|Sault Ste. Marie, MI Micro Area|M2|2|G3110|4036314385|2952483936|+46.3218192|-084.5206297
|42740|42740|Sedalia, MO|Sedalia, MO Micro Area|M2|2|G3110|1766949557|10504062|+38.7273667|-093.2852073
496|42340|42340|Savannah, GA|Savannah, GA Metro Area|M1|1|G3110|3476938789|588431769|+32.1093306|-081.2733250
146|42780|42780|Selinsgrove, PA|Selinsgrove, PA Micro Area|M2|2|G3110|851343884|7291931|+40.7554068|-077.0729288
|42380|42380|Sayre, PA|Sayre, PA Micro Area|M2|2|G3110|2971750797|35275640|+41.7914949|-076.5021237
|42420|42420|Scottsbluff, NE|Scottsbluff, NE Micro Area|M2|2|G3110|9200241500|17707405|+42.1633258|-103.7344731
174|42460|42460|Scottsboro, AL|Scottsboro, AL Micro Area|M2|2|G3110|2791664974|126657151|+34.7641140|-085.9800556
|42540|42540|Scranton--Wilkes-Barre--Hazleton, PA|Scranton--Wilkes-Barre--Hazleton, PA Metro Area|M1|1|G3110|4524119959|76248561|+41.3228807|-075.8981878
340|42620|42620|Searcy, AR|Searcy, AR Micro Area|M2|2|G3110|2680817964|18326633|+35.2547221|-091.7531583
500|42660|42660|Seattle-Tacoma-Bellevue, WA|Seattle-Tacoma-Bellevue, WA Metro Area|M1|1|G3110|15208915217|1132731022|+47.5530503|-121.8831653
370|42680|42680|Sebastian-Vero Beach, FL|Sebastian-Vero Beach, FL Metro Area|M1|1|G3110|1302371286|295576120|+27.7006382|-080.5748033
|42700|42700|Sebring, FL|Sebring, FL Metro Area|M1|1|G3110|2632923653|231677881|+27.3426272|-081.3409213
|42820|42820|Selma, AL|Selma, AL Micro Area|M2|2|G3110|2534807336|39134779|+32.3335397|-087.1143556
273|42860|42860|Seneca, SC|Seneca, SC Micro Area|M2|2|G3110|1622110661|122278146|+34.7487713|-083.0615427
464|42900|42900|Seneca Falls, NY|Seneca Falls, NY Micro Area|M2|2|G3110|838399641|172832706|+42.7822943|-076.8270880
314|42940|42940|Sevierville, TN|Sevierville, TN Micro Area|M2|2|G3110|1534597675|13491710|+35.8018095|-083.5156955
294|42980|42980|Seymour, IN|Seymour, IN Micro Area|M2|2|G3110|1319114198|11915575|+38.9119571|-086.0425161
267|43020|43020|Shawano, WI|Shawano, WI Micro Area|M2|2|G3110|3239211923|61547964|+44.8515650|-088.7455190
416|43060|43060|Shawnee, OK|Shawnee, OK Micro Area|M2|2|G3110|2040060361|14842418|+35.2113928|-096.9570070
|43100|43100|Sheboygan, WI|Sheboygan, WI Metro Area|M1|1|G3110|1324171516|1968280170|+43.7460015|-087.7305455
172|43140|43140|Shelby, NC|Shelby, NC Micro Area|M2|2|G3110|1202562915|10201818|+35.3346302|-081.5571145
206|44860|44860|Sulphur Springs, TX|Sulphur Springs, TX Micro Area|M2|2|G3110|1987018485|66250918|+33.1489586|-095.5651936
400|43180|43180|Shelbyville, TN|Shelbyville, TN Micro Area|M2|2|G3110|1226717441|2983152|+35.5136604|-086.4582939
500|43220|43220|Shelton, WA|Shelton, WA Micro Area|M2|2|G3110|2484997510|237129533|+47.3541257|-123.1738498
|43260|43260|Sheridan, WY|Sheridan, WY Micro Area|M2|2|G3110|6537116226|7986337|+44.7813692|-106.8812114
206|43300|43300|Sherman-Denison, TX|Sherman-Denison, TX Metro Area|M1|1|G3110|2415988554|120125251|+33.6245321|-096.6757378
470|44900|44900|Summerville, GA|Summerville, GA Micro Area|M2|2|G3110|811512405|570807|+34.4741785|-085.3452894
|43320|43320|Show Low, AZ|Show Low, AZ Micro Area|M2|2|G3110|25771504246|24078098|+35.3907852|-110.3210248
|43340|43340|Shreveport-Bossier City, LA|Shreveport-Bossier City, LA Metro Area|M1|1|G3110|8255229021|326622308|+32.4906379|-093.6711914
482|44920|44920|Summit Park, UT|Summit Park, UT Micro Area|M2|2|G3110|4847461965|26784448|+40.8720603|-110.9684862
212|43380|43380|Sidney, OH|Sidney, OH Micro Area|M2|2|G3110|1055875200|7809835|+40.3366802|-084.2041425
|44940|44940|Sumter, SC|Sumter, SC Metro Area|M1|1|G3110|1722537921|44054032|+33.9162531|-080.3822876
|43420|43420|Sierra Vista-Douglas, AZ|Sierra Vista-Douglas, AZ Metro Area|M1|1|G3110|15968981851|137024899|+31.8401287|-109.7751627
164|43460|43460|Sikeston, MO|Sikeston, MO Micro Area|M2|2|G3110|1087765670|15199719|+37.0477927|-089.5680975
|43500|43500|Silver City, NM|Silver City, NM Micro Area|M2|2|G3110|10260554397|15353565|+32.7320870|-108.3815043
512|43580|43580|Sioux City, IA-NE-SD|Sioux City, IA-NE-SD Metro Area|M1|1|G3110|7606652092|57004560|+42.5806338|-096.3760468
|43620|43620|Sioux Falls, SD|Sioux Falls, SD Metro Area|M1|1|G3110|6671032918|27126729|+43.4954205|-096.9953387
|43660|43660|Snyder, TX|Snyder, TX Micro Area|M2|2|G3110|2345088411|5439884|+32.7444622|-100.9133987
|43700|43700|Somerset, KY|Somerset, KY Micro Area|M2|2|G3110|1705273861|48547347|+37.1083118|-084.5799857
306|43740|43740|Somerset, PA|Somerset, PA Micro Area|M2|2|G3110|2782597410|17002635|+39.9812968|-079.0284859
|43760|43760|Sonora, CA|Sonora, CA Micro Area|M2|2|G3110|5752116634|138684399|+38.0214344|-119.9647335
515|43780|43780|South Bend-Mishawaka, IN-MI|South Bend-Mishawaka, IN-MI Metro Area|M1|1|G3110|2455177044|56341408|+41.7749808|-086.1230143
273|43900|43900|Spartanburg, SC|Spartanburg, SC Metro Area|M1|1|G3110|3424298865|34021566|+34.8346199|-081.8424008
452|43940|43940|Spearfish, SD|Spearfish, SD Micro Area|M2|2|G3110|2072089203|713642|+44.3485831|-103.8058171
|43980|43980|Spencer, IA|Spencer, IA Micro Area|M2|2|G3110|1469139488|13866649|+43.0798220|-095.1497261
|44020|44020|Spirit Lake, IA|Spirit Lake, IA Micro Area|M2|2|G3110|985764408|60490793|+43.3896107|-095.1960572
518|44060|44060|Spokane-Spokane Valley, WA|Spokane-Spokane Valley, WA Metro Area|M1|1|G3110|14611487513|272314704|+48.1890407|-117.5732186
522|44100|44100|Springfield, IL|Springfield, IL Metro Area|M1|1|G3110|3063280587|25218752|+39.8285650|-089.6962052
521|44140|44140|Springfield, MA|Springfield, MA Metro Area|M1|1|G3110|2964007329|90781038|+42.2477995|-072.6320465
520|44180|44180|Springfield, MO|Springfield, MO Metro Area|M1|1|G3110|7787628880|35980421|+37.3608589|-093.1802486
212|44220|44220|Springfield, OH|Springfield, OH Metro Area|M1|1|G3110|1029469489|13070242|+39.9170315|-083.7836760
|44260|44260|Starkville, MS|Starkville, MS Micro Area|M2|2|G3110|1186744060|9654987|+33.4223134|-088.8761514
524|44300|44300|State College, PA|State College, PA Metro Area|M1|1|G3110|2874687475|7878537|+40.9091603|-077.8478296
496|44340|44340|Statesboro, GA|Statesboro, GA Micro Area|M2|2|G3110|1742653960|40877525|+32.3934083|-081.7438099
277|44420|44420|Staunton-Waynesboro, VA|Staunton-Waynesboro, VA Metro Area|M1|1|G3110|2595234255|10537830|+38.1609584|-079.1276321
525|44460|44460|Steamboat Springs, CO|Steamboat Springs, CO Micro Area|M2|2|G3110|6117617656|15831752|+40.4836638|-106.9877021
|44500|44500|Stephenville, TX|Stephenville, TX Micro Area|M2|2|G3110|2805141498|17445007|+32.2381358|-098.2223769
|44540|44540|Sterling, CO|Sterling, CO Micro Area|M2|2|G3110|4761982864|16363552|+40.7280911|-103.0904639
221|44580|44580|Sterling, IL|Sterling, IL Micro Area|M2|2|G3110|1772198884|31796433|+41.7505708|-089.9109567
554|44620|44620|Stevens Point, WI|Stevens Point, WI Micro Area|M2|2|G3110|2073848481|56925265|+44.4762457|-089.4980699
|44660|44660|Stillwater, OK|Stillwater, OK Micro Area|M2|2|G3110|1773393768|31771389|+36.0792254|-096.9752553
488|44700|44700|Stockton-Lodi, CA|Stockton-Lodi, CA Metro Area|M1|1|G3110|3603645870|91127736|+37.9349815|-121.2722440
|44740|44740|Storm Lake, IA|Storm Lake, IA Micro Area|M2|2|G3110|1488989048|13791665|+42.7415210|-095.1414313
310|44780|44780|Sturgis, MI|Sturgis, MI Micro Area|M2|2|G3110|1296531678|52934828|+41.9114878|-085.5228703
146|44980|44980|Sunbury, PA|Sunbury, PA Micro Area|M2|2|G3110|1187166521|49616090|+40.8515244|-076.7098770
|45000|45000|Susanville, CA|Susanville, CA Micro Area|M2|2|G3110|11761622226|463440332|+40.7210862|-120.6299518
|45020|45020|Sweetwater, TX|Sweetwater, TX Micro Area|M2|2|G3110|2362061403|5052652|+32.3123380|-100.4181079
532|45060|45060|Syracuse, NY|Syracuse, NY Metro Area|M1|1|G3110|6176905547|1020646829|+43.0065163|-076.1961336
538|45140|45140|Tahlequah, OK|Tahlequah, OK Micro Area|M2|2|G3110|1940958390|69624055|+35.9043668|-094.9967964
142|45180|45180|Talladega-Sylacauga, AL|Talladega-Sylacauga, AL Micro Area|M2|2|G3110|3594135497|100885674|+33.1860858|-086.1977569
533|45220|45220|Tallahassee, FL|Tallahassee, FL Metro Area|M1|1|G3110|6184147166|556504751|+30.3864276|-084.2804098
|45300|45300|Tampa-St. Petersburg-Clearwater, FL|Tampa-St. Petersburg-Clearwater, FL Metro Area|M1|1|G3110|6511715485|2116363967|+28.1259071|-082.4652858
|45340|45340|Taos, NM|Taos, NM Micro Area|M2|2|G3110|5705968167|3385857|+36.5765287|-105.6379865
522|45380|45380|Taylorville, IL|Taylorville, IL Micro Area|M2|2|G3110|1837278878|16221508|+39.5455242|-089.2795927
|47180|47180|Vincennes, IN|Vincennes, IN Micro Area|M2|2|G3110|1336514269|20755095|+38.6883910|-087.4203544
|45460|45460|Terre Haute, IN|Terre Haute, IN Metro Area|M1|1|G3110|3794374486|51286347|+39.3923890|-087.3470958
|45500|45500|Texarkana, TX-AR|Texarkana, TX-AR Metro Area|M1|1|G3110|5290957373|213758330|+33.4783701|-094.2071694
|45520|45520|The Dalles, OR|The Dalles, OR Micro Area|M2|2|G3110|6168174849|35950032|+45.1645359|-121.1650693
422|45540|45540|The Villages, FL|The Villages, FL Metro Area|M1|1|G3110|1417703612|84037410|+28.7142938|-082.0747152
122|45580|45580|Thomaston, GA|Thomaston, GA Micro Area|M2|2|G3110|837697122|10663317|+32.8818366|-084.2922810
|45620|45620|Thomasville, GA|Thomasville, GA Micro Area|M2|2|G3110|1410508592|19729671|+30.8646064|-083.9198196
248|45660|45660|Tiffin, OH|Tiffin, OH Micro Area|M2|2|G3110|1427135453|4593158|+41.1200224|-083.1275037
|45700|45700|Tifton, GA|Tifton, GA Micro Area|M2|2|G3110|670826488|25333971|+31.4570027|-083.5259307
428|47220|47220|Vineland-Bridgeton, NJ|Vineland-Bridgeton, NJ Metro Area|M1|1|G3110|1252937982|502092013|+39.3283874|-075.1216435
|45740|45740|Toccoa, GA|Toccoa, GA Micro Area|M2|2|G3110|463948108|13121937|+34.5529139|-083.2902156
534|45780|45780|Toledo, OH|Toledo, OH Metro Area|M1|1|G3110|3531459906|673620446|+41.5440030|-083.6908801
|45820|45820|Topeka, KS|Topeka, KS Metro Area|M1|1|G3110|8372473532|148304222|+39.0413888|-095.8026393
408|45860|45860|Torrington, CT|Torrington, CT Micro Area|M2|2|G3110|2384267172|62137425|+41.7918833|-073.2354042
|45900|45900|Traverse City, MI|Traverse City, MI Micro Area|M2|2|G3110|4379940143|7440196033|+44.9523239|-085.9083200
408|45940|45940|Trenton, NJ|Trenton, NJ Metro Area|M1|1|G3110|581626924|11191986|+40.2825027|-074.7037240
|45980|45980|Troy, AL|Troy, AL Micro Area|M2|2|G3110|1740741440|2336918|+31.7986508|-085.9416035
472|46020|46020|Truckee-Grass Valley, CA|Truckee-Grass Valley, CA Micro Area|M2|2|G3110|2480636840|41514869|+39.2975082|-120.7713429
536|46060|46060|Tucson, AZ|Tucson, AZ Metro Area|M1|1|G3110|23794315879|5272990|+32.1285226|-111.7830267
|46100|46100|Tullahoma-Manchester, TN|Tullahoma-Manchester, TN Micro Area|M2|2|G3110|2881800291|72655850|+35.3030848|-086.1119048
538|46140|46140|Tulsa, OK|Tulsa, OK Metro Area|M1|1|G3110|16237914189|493634263|+36.2541502|-096.1749783
|46180|46180|Tupelo, MS|Tupelo, MS Micro Area|M2|2|G3110|3834425284|36689773|+34.2682708|-088.6829073
|46220|46220|Tuscaloosa, AL|Tuscaloosa, AL Metro Area|M1|1|G3110|7373856145|131613381|+33.1606309|-087.7151685
|46300|46300|Twin Falls, ID|Twin Falls, ID Micro Area|M2|2|G3110|6522650092|31249886|+42.4403972|-114.5687294
540|46340|46340|Tyler, TX|Tyler, TX Metro Area|M1|1|G3110|2386630581|73136762|+32.3751061|-095.2687428
|46380|46380|Ukiah, CA|Ukiah, CA Micro Area|M2|2|G3110|9081415546|962953371|+39.4323876|-123.4428811
362|46460|46460|Union City, TN-KY|Union City, TN-KY Micro Area|M2|2|G3110|1944536021|91518909|+36.4088231|-089.1626826
212|46500|46500|Urbana, OH|Urbana, OH Micro Area|M2|2|G3110|1110247658|3015669|+40.1327594|-083.7675425
|46520|46520|Urban Honolulu, HI|Urban Honolulu, HI Metro Area|M1|1|G3110|1555614857|4054819637|+21.4613654|-158.2019740
|46540|46540|Utica-Rome, NY|Utica-Rome, NY Metro Area|M1|1|G3110|6795957319|237512250|+43.3322887|-075.1731690
|46620|46620|Uvalde, TX|Uvalde, TX Micro Area|M2|2|G3110|4019520918|17321957|+29.3503081|-099.7684270
|46660|46660|Valdosta, GA|Valdosta, GA Metro Area|M1|1|G3110|4116442098|102347808|+30.8274985|-083.2421316
488|46700|46700|Vallejo-Fairfield, CA|Vallejo-Fairfield, CA Metro Area|M1|1|G3110|2128362628|218664495|+38.2672255|-121.9395940
194|46740|46740|Valley, AL|Valley, AL Micro Area|M2|2|G3110|1545009295|17048126|+32.9155039|-085.3940321
338|46780|46780|Van Wert, OH|Van Wert, OH Micro Area|M2|2|G3110|1059698928|3281852|+40.8555203|-084.5857751
512|46820|46820|Vermillion, SD|Vermillion, SD Micro Area|M2|2|G3110|1067562650|13071016|+42.9161495|-096.9804680
|46860|46860|Vernal, UT|Vernal, UT Micro Area|M2|2|G3110|11602247815|56187300|+40.1258872|-109.5177482
|46900|46900|Vernon, TX|Vernon, TX Micro Area|M2|2|G3110|2514474406|18257915|+34.0849199|-099.2424397
298|46980|46980|Vicksburg, MS|Vicksburg, MS Micro Area|M2|2|G3110|2786647917|113512580|+32.1817603|-090.8761247
544|47020|47020|Victoria, TX|Victoria, TX Metro Area|M1|1|G3110|4491432457|36383637|+28.7314546|-097.1969934
|47080|47080|Vidalia, GA|Vidalia, GA Micro Area|M2|2|G3110|1563141371|31476878|+32.1542390|-082.4113819
|47240|47240|Vineyard Haven, MA|Vineyard Haven, MA Micro Area|M2|2|G3110|267403598|1004179934|+41.3809686|-070.7015043
545|47260|47260|Virginia Beach-Norfolk-Newport News, VA-NC|Virginia Beach-Norfolk-Newport News, VA-NC Metro Area|M1|1|G3110|6970679398|3215766557|+36.8560812|-076.3737908
546|47300|47300|Visalia-Porterville, CA|Visalia-Porterville, CA Metro Area|M1|1|G3110|12494776154|37391591|+36.2288241|-118.7810610
|47340|47340|Wabash, IN|Wabash, IN Micro Area|M2|2|G3110|1068206255|22115988|+40.8437475|-085.7951915
|47380|47380|Waco, TX|Waco, TX Metro Area|M1|1|G3110|4668694665|81529831|+31.4272264|-097.0934727
|48060|48060|Watertown-Fort Drum, NY|Watertown-Fort Drum, NY Metro Area|M1|1|G3110|3285857552|1524359927|+43.9965164|-076.0529023
244|47420|47420|Wahpeton, ND-MN|Wahpeton, ND-MN Micro Area|M2|2|G3110|5663688420|25518438|+46.2939501|-096.7907012
|47460|47460|Walla Walla, WA|Walla Walla, WA Metro Area|M1|1|G3110|5539408616|87394643|+46.2635366|-118.2558832
338|47540|47540|Wapakoneta, OH|Wapakoneta, OH Micro Area|M2|2|G3110|1039599291|1345175|+40.5613090|-084.2240177
356|47580|47580|Warner Robins, GA|Warner Robins, GA Metro Area|M1|1|G3110|2006841389|19638264|+32.4015944|-083.6350953
|47620|47620|Warren, PA|Warren, PA Micro Area|M2|2|G3110|2289914229|37352294|+41.8436691|-079.3131731
312|47660|47660|Warrensburg, MO|Warrensburg, MO Micro Area|M2|2|G3110|2147833526|10122990|+38.7415280|-093.8118634
|47700|47700|Warsaw, IN|Warsaw, IN Micro Area|M2|2|G3110|1376280527|59590716|+41.2442928|-085.8615754
|47780|47780|Washington, IN|Washington, IN Micro Area|M2|2|G3110|1112371102|19127743|+38.6945459|-087.0727590
274|47820|47820|Washington, NC|Washington, NC Micro Area|M2|2|G3110|2143054135|338699325|+35.4823128|-076.8420144
548|47900|47900|Washington-Arlington-Alexandria, DC-VA-MD-WV|Washington-Arlington-Alexandria, DC-VA-MD-WV Metro Area|M1|1|G3110|16172891051|1127986426|+38.8169283|-077.4482275
198|47920|47920|Washington Court House, OH|Washington Court House, OH Micro Area|M2|2|G3110|1052458603|1705305|+39.5552748|-083.4619451
|47940|47940|Waterloo-Cedar Falls, IA|Waterloo-Cedar Falls, IA Metro Area|M1|1|G3110|3893009687|28166453|+42.5367962|-092.4716080
|47980|47980|Watertown, SD|Watertown, SD Micro Area|M2|2|G3110|1782118019|75327852|+44.9662852|-097.1988375
376|48020|48020|Watertown-Fort Atkinson, WI|Watertown-Fort Atkinson, WI Micro Area|M2|2|G3110|1441259888|68019805|+43.0138065|-088.7739855
|48100|48100|Wauchula, FL|Wauchula, FL Micro Area|M2|2|G3110|1651878530|1439671|+27.4928458|-081.8215798
554|48140|48140|Wausau, WI|Wausau, WI Metro Area|M1|1|G3110|4001546323|81139027|+44.8980363|-089.7578230
|48180|48180|Waycross, GA|Waycross, GA Micro Area|M2|2|G3110|3133676203|106962923|+31.1331137|-082.3686504
276|49620|49620|York-Hanover, PA|York-Hanover, PA Metro Area|M1|1|G3110|2341819924|16940560|+39.9217514|-076.7288887
566|49660|49660|Youngstown-Warren-Boardman, OH-PA|Youngstown-Warren-Boardman, OH-PA Metro Area|M1|1|G3110|4409142508|108732898|+41.2363015|-080.5618679
|48220|48220|Weatherford, OK|Weatherford, OK Micro Area|M2|2|G3110|2561032884|34321688|+35.6456012|-098.9973857
430|48260|48260|Weirton-Steubenville, WV-OH|Weirton-Steubenville, WV-OH Metro Area|M1|1|G3110|1502326587|29633337|+40.3889142|-080.7019657
472|49700|49700|Yuba City, CA|Yuba City, CA Metro Area|M1|1|G3110|3197202340|46750406|+39.1609692|-121.5118327
|48300|48300|Wenatchee, WA|Wenatchee, WA Metro Area|M1|1|G3110|12276093180|266101526|+47.8211284|-120.2675436
|48460|48460|West Plains, MO|West Plains, MO Micro Area|M2|2|G3110|2401562527|2913502|+36.7743685|-091.8873677
|48540|48540|Wheeling, WV-OH|Wheeling, WV-OH Metro Area|M1|1|G3110|2443343848|49394304|+39.9755090|-080.8470113
376|48580|48580|Whitewater-Elkhorn, WI|Whitewater-Elkhorn, WI Micro Area|M2|2|G3110|1438031617|55247150|+42.6681095|-088.5417306
|49740|49740|Yuma, AZ|Yuma, AZ Metro Area|M1|1|G3110|14281187259|13175612|+32.7739424|-113.9109050
198|49780|49780|Zanesville, OH|Zanesville, OH Micro Area|M2|2|G3110|1721322173|20660209|+39.9660457|-081.9435064
556|48620|48620|Wichita, KS|Wichita, KS Metro Area|M1|1|G3110|12981358617|92861352|+37.6298391|-097.3988237
|49820|49820|Zapata, TX|Zapata, TX Micro Area|M2|2|G3110|2585875921|154370983|+26.9969806|-099.1826027
|48660|48660|Wichita Falls, TX|Wichita Falls, TX Metro Area|M1|1|G3110|6784779607|144176932|+33.7761441|-098.5019073
558|48700|48700|Williamsport, PA|Williamsport, PA Metro Area|M1|1|G3110|3182061079|39456941|+41.3436196|-077.0552254
|48780|48780|Williston, ND|Williston, ND Micro Area|M2|2|G3110|5380439857|182522840|+48.3557649|-103.5013332
|48820|48820|Willmar, MN|Willmar, MN Micro Area|M2|2|G3110|2064994144|168491033|+45.1527137|-095.0049812
|48900|48900|Wilmington, NC|Wilmington, NC Metro Area|M1|1|G3110|2749031421|516884897|+34.4260331|-077.8896340
178|48940|48940|Wilmington, OH|Wilmington, OH Micro Area|M2|2|G3110|1058488036|9350863|+39.4290042|-083.7950485
468|48980|48980|Wilson, NC|Wilson, NC Micro Area|M2|2|G3110|953483827|14476512|+35.7003569|-077.9215978
548|49020|49020|Winchester, VA-WV|Winchester, VA-WV Metro Area|M1|1|G3110|2753433356|16219862|+39.2729744|-078.4718276
|49080|49080|Winnemucca, NV|Winnemucca, NV Micro Area|M2|2|G3110|24969524983|44196981|+41.4079136|-118.1275915
|49100|49100|Winona, MN|Winona, MN Micro Area|M2|2|G3110|1621877195|39812919|+43.9822682|-091.7767076
268|49180|49180|Winston-Salem, NC|Winston-Salem, NC Metro Area|M1|1|G3110|5201850702|80932466|+36.0788515|-080.3450642
554|49220|49220|Wisconsin Rapids-Marshfield, WI|Wisconsin Rapids-Marshfield, WI Micro Area|M2|2|G3110|2054062243|42280557|+44.4614126|-090.0388252
